Titre,Nom_Entreprise,Adresse,Salaire,Descriptif_du_poste,Date_de_publication,métier_sc,loc_sc,Date_sc,Identifiant,Experiences,contrat
Développeur / Développeuse Big Data – Nantes H/F,Crédit Agricole Technologies & Services,Nantes (44),vide,"Nantes (44)
CDI
Métier
Informatique / Réseaux
Titre du poste
Développeur / Développeuse Big Data – Nantes H/F
Description du poste
« Et si vous mettiez votre expertise et votre engagement à 100%
au service de notre entreprise ? »

Vous avez de l'expérience dans le développement informatique ? Vous êtes créatif et passionné, aimez travailler en équipe ? Vous aspirez à enrichir vos compétences et à évoluer dans un environnement stimulant?

Si oui, ce poste est fait pour vous !

Crédit Agricole Technologies et Services (CA-TS) en bref
Crédit Agricole Technologies et Services est l'entité en charge de l'informatique du réseau bancaire régionalisé du groupe Crédit Agricole.
Dans un contexte de digitalisation de la banque, nous sommes engagés dans une transformation vers un mode de fonctionnement Agile afin de répondre aux nouveaux enjeux de nos 21 millions d'utilisateurs en France. Notre objectif : se nourrir des évolutions technologiques et fournir des services innovants en plaçant la vision client cœur de nos préoccupations.

Vous intégrerez la Tribu Datahub (Système d'Information Décisionnel, big data, data management, pilotage et décisionnel, …) qui fait partie du Pôle Produit Data Pilotage et Marketing.

Quel sera mon rôle ?
Vous garantissez le bon développement des applications IT et élaborez des solutions techniques adaptées. Vous travaillez avec l'ensemble de votre équipe (Squad Big Data) et donnez la vision technique du produit. Vos missions principales :
Réaliser la conception, développement et tests unitaires des applications informatiques dans le respect des normes et standards que qualité
Effectuer des évolutions fonctionnelles ou corrections d'incidents
Participer au chiffrage des solutions IT (poker planning) et contribuer à la priorisation (backlog)
Etre responsable des évolutions fonctionnelles et participer aux démonstrations associées, incluant les tests de performance
Contribuer à la résolution des blocages rencontrés par d'autres développeurs
Profil
Quel est le profil recherché ?
Maitrise des technologies et environnement JAVA, Python, Scala, Hadoop, SQL, Suite HortonWorks
Vous avez à minima une première expérience réussie dans le développement informatique et vous souhaitez vous spécialiser dans les technologies du Big Data
Autonomie, enthousiasme et esprit d'initiative, notamment dans la recherche de solutions
Bonne communication et capacité à travailler en équipe
Diplôme de niveau Bac +5
Forte appétence à travailler dans un contexte agile - une expérience dans un environnement agile serait un plus

Pourquoi rejoindre CA-TS ?
Participation à des projets à fort impact dans le cadre de notre transformation digitale
Autonomie et co-localisation des équipes dans un environnement dynamique et créatif
Opportunité de carrière et dispositif de formation global et innovant
Des valeurs humaines et bienveillantes avec un accompagnement de proximité
Avantages et stabilité d'un grand groupe

« Parce que le handicap ne doit plus être un handicap en entreprise, nous, Crédit Agricole Technologies et Services, avons ouvert nos métiers à tous les talents, sans exception.»
Contrat
CDI
Localisation du poste
Localisation du poste
Pays-de-la-Loire, Loire Atlantique (44)
Lieu de travail
nantes
Critères candidat
Niveau d'études min. requis
Bac+5
Crédit Agricole Caisses Régionales - il y a 30+ jours
- Continuer pour postuler
Signaler cette offre d'emploi",14/09/2019,Big_data,Nantes,14/10/2019,vjk=23538d42bcf20e2d,vide,cdi
CONSULTANT BIG DATA H/F RENNES,Umanis,Saint-Herblain (44),vide,"Saint-Herblain (44)
THE FRENCH LEADER OF THE DATA RECRUITS.
Joining Umanis is to participate in a formidable adventure, that of a French company in continuous growth, recognized for its capacity for innovation and its dynamism.
Umanis is more than 2700 enthusiasts of new technologies who share the same values as excellence, responsibility, respect and conviviality.
Umanis, it is a community with an average age of 35 years that intervenes in advanced engineering on the strategic projects of the largest customers of order or on behalf of companies for whom data is transformation vector.
Umanis, it is a management and an organization closest to its collaborators to accompany you in your career. Training, certifications, MOOC, CPEC; We are committed to making you evolve continuously.
YOUR MISSIONS:
Umanis Rennes est une agence à taille humaine qui regroupe une trentaine de collaborateurs en 2019. Pour toujours mieux se développer, nous sommes en quête de talents avides de nouvelles aventures bretonnes et souhaitant s’investir à nos côtés.
Pour renforcer l’équipe en place, nous recherchons notre futur(e) Consultant(e) Big Data !
En intégrant le projet de notre client, votre mission sera articulée autour de plusieurs axes :
Concevoir et mettre en place des chaines de processing Big Data (Hadoop, Spark)
Développer des modules de traitements de données Spark en Scala
Être force de proposition sur les solutions techniques mises en œuvre
Participer aux déploiements des solutions dans une démarche Agile / DevOps
Développer une expertise autour Java / Hadoop / Spark / Kafka
De formation supérieure en informatique, Ecoles d’Ingénieurs ou Universités, vous justifiez d’une ou plusieurs expériences en matière de développement Big Data (3, 5, 10 ans d’expérience, ce n’est pas la quantité qui compte, c’est le talent et la passion !)
Votre domaine de compétences couvre l’écosystème Hadoop : Hive, Kafka, Ambari, Cloudera, Hortonworks ; la capacité à implémenter des algorithmes distribués avec un langage de programmation Java, Scala, ou Python ; la connaissance de NoSQL, d’une solution telle que Cassandra ou MongoDB et d’un moteur de recherche type ElasticSearch.
Aimant le travail en équipe et maitrisant la langue anglaise, vous vous décrivez volontiers comme quelqu’un de polyvalent, créatif et plein d’humour !
Pourquoi Umanis ?
Un suivi régulier et personnalisé par votre manager et votre référente RH.
Une écoute constante pour accompagner votre montée en compétences et vous proposer les projets les plus en phase avec vos attentes.
Des moments de partage : soirées d’agence et afterworks, rencontres sportives…
La possibilité, en fonction de vos aspirations, de devenir l’un des référents techniques de notre équipe. Ceux qui, grâce à leur expertise, nous accompagnent dans le recrutement des futurs collaborateurs.
Notre objectif : continuer de grandir, sans jamais oublier le lien tissé avec chacun, car VOUS êtes notre valeur ajoutée !
REQUIRED COMPETENCIES:
Budgetary, financial and economic management (Intermediate), Design of works, products or events (Advanced), English (Confirmed), Functionnal Architecture SI (Advanced), Governance IT (Confirmed), Product or event development (Confirmed), Project management (Confirmed), Qualitative and quantitative analyzes (Advanced), Software mastery (Advanced), Technical Architecture SI (Advanced)
In 2018, Umanis recruited 900 new talents throughout the French territory. What if it was you?
il y a 30+ jours
- Continuer pour postuler
Signaler cette offre d'emploi",14/09/2019,Big_data,Nantes,14/10/2019,vjk=c2a865ff7bc09679,vide,vide
DEVELOPPEUR BIG DATA H/F RENNES,Umanis,Saint-Herblain (44),vide,"Saint-Herblain (44)
THE FRENCH LEADER OF THE DATA RECRUITS.
Joining Umanis is to participate in a formidable adventure, that of a French company in continuous growth, recognized for its capacity for innovation and its dynamism.
Umanis is more than 2700 enthusiasts of new technologies who share the same values as excellence, responsibility, respect and conviviality.
Umanis, it is a community with an average age of 35 years that intervenes in advanced engineering on the strategic projects of the largest customers of order or on behalf of companies for whom data is transformation vector.
Umanis, it is a management and an organization closest to its collaborators to accompany you in your career. Training, certifications, MOOC, CPEC; We are committed to making you evolve continuously.
The developer realizes the software or application according to the detailed specifications of the client and the chosen technical architecture
YOUR MISSIONS:
Umanis Rennes est une agence à taille humaine qui regroupe une trentaine de collaborateurs en 2019. Pour toujours mieux se développer, nous sommes en quête de talents avides de nouvelles aventures bretonnes et souhaitant s’investir à nos côtés.
Pour renforcer l’équipe en place, nous recherchons notre futur(e) Développeur(se) Big Data !
En intégrant le projet de notre client, votre mission sera articulée autour de plusieurs axes :
Etudes en amont et analyse des besoins
Modèles de DataWarehouse et de Hub innovants
Architecture des flux et des processus d’alimentation
Conception, mise en œuvre et déploiement des traitements informatiques de calcul et de reporting et des processus temps réel dans le cadre de la digitalisation
De formation supérieure en informatique, Ecoles d’Ingénieurs ou Universités, vous justifiez d’une ou plusieurs expériences en matière de Big Data (3, 5, 10 ans d’expérience, ce n’est pas la quantité qui compte, c’est le talent et la passion !)
Votre domaine de compétences couvre l’écosystème Hadoop : Hive, Kafka, Ambari, Cloudera, Hortonworks ;
la capacité à implémenter des algorithmes distribués avec un langage de programmation Java, Scala, ou Python ;
la connaissance de NoSQL, d’une solution telle que Cassandra ou MongoDB
d’un moteur de recherche type ElasticSearch ou Solr .
Aimant le travail en équipe et maitrisant la langue anglaise, vous vous décrivez volontiers comme quelqu’un de polyvalent, créatif et plein d’humour !
Pourquoi Umanis ?
Un suivi régulier et personnalisé par votre manager et votre référente RH.
Une écoute constante pour accompagner votre montée en compétences et vous proposer les projets les plus en phase avec vos attentes.
Des moments de partage : soirées d’agence et afterworks, rencontres sportives…
La possibilité, en fonction de vos aspirations, de devenir l’un des référents techniques de notre équipe. Ceux qui, grâce à leur expertise, nous accompagnent dans le recrutement des futurs collaborateurs.
Notre objectif : continuer de grandir, sans jamais oublier le lien tissé avec chacun, car VOUS êtes notre valeur ajoutée !
REQUIRED COMPETENCIES:
English
In 2018, Umanis recruited 900 new talents throughout the French territory. What if it was you?
il y a 30+ jours
- Continuer pour postuler
Signaler cette offre d'emploi",14/09/2019,Big_data,Nantes,14/10/2019,vjk=de947dd074cf9d46,vide,vide
Post Doc : Maths/Big Data,FrançAsie,Nantes (44),vide,"Nantes (44)
Nous cherchons :
Post Doc : Maths/Big Data au siège de l’école CNAM Paris (75).
Les tâches à accomplir essentielles sont :
– Compléter et mettre à jour ma veille technologique déjà effectuée
– Maîtriser les outils R nécessaires (nous pouvons vous aider évidemment) : valeurs extrêmes, la théorie est entre autres dans un livre de Paul Embrechts, Quantitative Risk Management de 2007. Mais aussi calcul parallèle en R (indispensable, nous pouvons vous aider), gestion de chaînes de caractères, gestion de dates etc.
– Trouver des bases de données publiques pouvant servir d’exemple pour nos calculs : probablement dans open data gouv fr
– Du classique en machine learning qui se transpose sur l’anonymisation : encodage de valeurs réelles, découpage en blocs etc.
– Rédaction du rapport final du projet (très important)
– Préparation d’une conférence sur le sujet au Cnam (nous pouvons peut-être mettre un budget spécial pour cela)
– Rédaction d’un article (ou deux si possible, si les calculs marchent vraiment bien)
Profil
– Titulaire au moins d’un PhD

Merci de nous transmettre votre CV à recrutement@francasie.com
il y a 4 mois
- Continuer pour postuler
Signaler cette offre d'emploi",14/06/2019,Big_data,Nantes,14/10/2019,vjk=88641cdefaf7ea33,vide,vide
ANALYSTE DÉVELOPPEUR SOLUTIONS BIG DATA (H/F),Crédit mutuel,Nantes (44),vide,"Nantes (44)
CDI
En accompagnement du développement de projets mettant en œuvre des technologies Big Data et Data Science, vous serez amené à :

Choisir et mettre en œuvre les solutions et les architectures Big Data et Data Science, dans un contexte d’intégration continue et d’automatisation,
Garantir le maintien opérationnel de ces solutions,
Conseiller et accompagner les développeurs,
Contribuer activement à des travaux de veille technologique et d’études de faisabilité / prototypage.
Activités et tâches spécifiques
Vous participerez à la vie collaborative de l’équipe et vous serez accompagné par un tuteur pour faciliter votre intégration.
Connaissances et compétences
De formation Bac +4/+5, vous bénéficiez d’une première expérience réussie dans la mise en œuvre de solutions Data, soit en entreprise, soit dans le cadre d’un projet d’études. Vous disposez d’une forte appétence pour les technologies et les innovations
Vous pratiquez les langages Java, SQL, Shell.
Des compétences sur une ou plusieurs solutions Big Data (Hadoop/YARN/Hive, Kafka, Spark, Cassandra, Elasticsearch, …) sont souhaitées.
Des connaissances en Intégration et Déploiement Continus seraient un plus (Git, Artifactory, Jenkins/Gitlab, Ansible, …), de même sur Docker/Kubernetes/Openshift.

Des connaissances en Machine Learning (Théories, Langages, Frameworks, IDE) seraient appréciées ainsi que la maîtrise des langages/codes R, Python, RStudio/Jupyter, Scikit, Keras, Tensorflow,…

La pratique de l’anglais est souhaitée.
Savoir-être - savoir-faire
Doté d’un bon sens relationnel, vous appréciez travailler en équipe et vous souhaitez vous investir sur des projets innovants. Vous êtes curieux, faites preuve d'autonomie, d'initiatives et d'esprit de synthèse.
Autres informations
Le poste est à pourvoir à Nantes, en CDI, dès que possible.

Vous bénéficierez d’avantages « Convention Collective Banque » comme :
13ème mois,
RTT,
Prime d’intéressement et de participation,
Abondement,
Conditions bancaires avantageuses,
Régime de Frais de Santé et de Retraite très attractif,
Et encore plein d’autres avantages à découvrir …

Vous évoluez dans un environnement stimulant basé sur un management de proximité. Un Groupe qui s’engage pour ses salariés par la formation et l’évolution professionnelle.
Vous recherchez un projet innovant ? Alors Rejoignez la Team EI en postulant!
Retour
il y a 5 mois
- Continuer pour postuler
Signaler cette offre d'emploi",14/05/2019,Big_data,Nantes,14/10/2019,vjk=a287fc268e0b425b,vide,cdi
ANALYSTE DÉVELOPPEUR SOLUTIONS BIG DATA (H/F),Euro Information,Nantes (44),vide,"Nantes (44)
CDI
Présentation de la société
Euro-Information, filiale Informatique du groupe de bancassurance Crédit Mutuel, conçoit, réalise, maintient et exploite un système d’information commun utilisé par le Groupe.

Les activités de développement et de production informatique au niveau national et international sont assurées par environ 3200 salariés répartis sur plusieurs sites géographiques au niveau national : Strasbourg, Nancy, Dijon, Orléans, Lyon, Lille, Cergy, Val de Fontenay, Paris et Nantes.
Mission principale
En accompagnement du développement de projets mettant en œuvre des technologies Big Data et Data Science, vous serez amené à :

Choisir et mettre en œuvre les solutions et les architectures Big Data et Data Science, dans un contexte d’intégration continue et d’automatisation,
Garantir le maintien opérationnel de ces solutions,
Conseiller et accompagner les développeurs,
Contribuer activement à des travaux de veille technologique et d’études de faisabilité / prototypage.
Vous participerez à la vie collaborative de l’équipe et vous serez accompagné par un tuteur pour faciliter votre intégration.
Connaissances et compétences
De formation Bac +4/+5, vous bénéficiez d’une première expérience réussie dans la mise en œuvre de solutions Data, soit en entreprise, soit dans le cadre d’un projet d’études. Vous disposez d’une forte appétence pour les technologies et les innovations
Vous pratiquez les langages Java, SQL, Shell.
Des compétences sur une ou plusieurs solutions Big Data (Hadoop/YARN/Hive, Kafka, Spark, Cassandra, Elasticsearch, …) sont souhaitées.
Des connaissances en Intégration et Déploiement Continus seraient un plus (Git, Artifactory, Jenkins/Gitlab, Ansible, …), de même sur Docker/Kubernetes/Openshift.

Des connaissances en Machine Learning (Théories, Langages, Frameworks, IDE) seraient appréciées ainsi que la maîtrise des langages/codes R, Python, RStudio/Jupyter, Scikit, Keras, Tensorflow,…

La pratique de l’anglais est souhaitée.
Savoir-être - savoir-faire
Doté d’un bon sens relationnel, vous appréciez travailler en équipe et vous souhaitez vous investir sur des projets innovants. Vous êtes curieux, faites preuve d'autonomie, d'initiatives et d'esprit de synthèse.
Autres informations
Le poste est à pourvoir à Nantes, en CDI, dès que possible.

Vous bénéficierez d’avantages « Convention Collective Banque » comme :
13ème mois,
RTT,
Prime d’intéressement et de participation,
Abondement,
Conditions bancaires avantageuses,
Régime de Frais de Santé et de Retraite très attractif,
Et encore plein d’autres avantages à découvrir …

Vous évoluez dans un environnement stimulant basé sur un management de proximité. Un Groupe qui s’engage pour ses salariés par la formation et l’évolution professionnelle.
Vous recherchez un projet innovant ? Alors Rejoignez la Team EI en postulant!
il y a 5 mois
- Continuer pour postuler
Signaler cette offre d'emploi",14/05/2019,Big_data,Nantes,14/10/2019,vjk=de2a2472eab8aa00,vide,cdi
Product Manager / Chef de Produit Big Data,Talend,Nantes (44),vide,"Nantes (44)
WHO WE ARE:

Talend is a leader in cloud data integration and data integrity.
We are a global company with offices in Redwood City, Paris, London, Bonn, Beijing, Tokyo, Singapore, Sydney, and Bangalore. Our customers are pioneers/innovative leaders in their market when it comes to data and cloud projects. We are proud to count Domino’s, the world’s largest pizza company, Euronext, the #1 stock exchange in Europe, and HP Inc., a leading IT company, as Talend customers.
We enable companies to transform their business by delivering trusted data at the speed of business. Talend offers a suite of apps for data integration and integrity that brings data, people and technology together by generating end-to-end data pipelines.
Customers can collect data; transform it to power analytics; govern it from end-to-end; and share it across internal and external stakeholders. They can work across systems and across environments: in the cloud and on-premises.

Vous recherchez un nouveau challenge, à définir la stratégie et roadmap de solutions innovantes en Big Data, dans un contexte international, et à contribuer à l'importante croissance d'un leader mondial en Big Data, Cloud, Real Time et Self-Service ?
Afin de soutenir sa forte croissance, Talend recherche un(e) Chef de Produit / Product Manager Big Data.
Poste en CDI basé à Nantes de préférence (ou à Suresnes).
Vos missions
La définition de la Roadmap produit en collaboration avec les équipes commerciales, marketing et R&D ;
La définition de la stratégie produit via une analyse du marché en anticipant les besoins des clients et en assurant une veille concurrentielle ;
Le développement du produit en étroite collaboration avec l’équipe R&D, vous vous assurez du succès de chaque release ;
Vous serez en contact avec les clients pour élaborer les roadmaps, comme représentant du logiciel, et vous participerez à la présentation des roadmaps ;
L’élaboration de la stratégie de commercialisation du produit : définition du pricing, communication interne et externe (presse, conférences) sur les nouvelles fonctionnalités ;
Formation produit et formation commerciale pour les Pre-Sales.
Votre profil
3 à 5 ans d’expérience comme Chef de Produit ou Product Owner dans le domaine du développement logiciel ;
Au moins 3 ans d’expérience dans les domaines du data management, du big data et des technologies associées, et excellente compréhension de ces concepts ;
Excellente compréhension d’un large éventail de clients et de use cases au sein de plusieurs secteurs (santé, retail, assurance ou finance) et capacité à les traduire en fonctionnalités produit et user stories ;
Expérience dans l’utilisation de solution de gestion de data governance ou metadata comme Collibra, GDE ou des technologies similaires de chez IBM, Oracle ou Informatica ;
Expérience avec les outils Agile de gestion de produits comme Aha !, Jira, Confluence, etc.
Sensibilité à la partie User Experience. Idéalement vous avez une expérience de collaboration avec des UX designers pour créer les wire-frames, mock-ups, analyse de comportements utilisateurs (use labs), etc.
Vous avez une excellente communication, vous savez vous affirmer et défendre vos idées, capacité à prendre des décisions ;
Niveau professionnel courant en Français et en Anglais ;
Des déplacements entre Suresnes et Nantes seront à prévoir.
AND NOW, A LITTLE ABOUT US:

Talend has received some pretty impressive accolades along the way:
""2018 Best Public Cloud Computing Companies To Work For"" by Glassdoor
Named a Leader for Data Integration Tools in the Gartner Magic Quadrant
Named a Leader in Big Data Fabric for the Forrester Wave
Ranked in the DBTA “100 Companies that Matter Most in Data”
Listed in the CRN Big Data 100 Companies

We are passionate about helping companies become more data driven; and, if we can be honest, we are all geeks at heart who pride ourselves on the vibrant company culture that we have built.

As a global employer, at Talend, we believe our success depends on diversity, inclusion and mutual respect among our team members. We seek to recruit, develop and retain the most talented people from a diverse candidate pool. We are committed to making all employment decisions on the basis of business need, merit, capability and equality of opportunity. All qualified applicants will receive consideration for employment without regard to race, color, religion, sex, sexual orientation, gender identity, or national origin.
il y a 5 mois
- Continuer pour postuler
Signaler cette offre d'emploi",14/05/2019,Big_data,Nantes,14/10/2019,vjk=9f60a4af90035026,vide,cdi
Consultant Big Data H/F,Alan Allman Associates,Nantes (44),vide,"Nantes (44)
CDI
A propos de Siderlog
Cabinet de conseil en management, organisation, système d'information, Siderlog Conseil accompagne ses clients grands comptes dans la déclinaison opérationnelle de leur stratégie.

Présent à Paris, Lyon, Nantes et Niort, le cabinet agit au cœur des projets de ses clients dans les domaines d’intervention suivants : la business intelligence, l'assistance à maîtrise d'ouvrage, la conduite du changement, le management de projet.
Suivez-nous
http://www.siderlog.fr

Contexte :
Vous maîtrisez les techniques fondamentales liées au Big Data et vous savez prendre des décisions stratégiques ? Rencontrez-nous !

Vos missions
Concevoir et alimenter une plateforme Big Data (Datalake, Datalab)
Conseiller les clients sur les solutions proposées
Savoir proposer des outils adaptés aux besoins du projet
Exécuter les différents scénarios de tests
Mettre en œuvre les benchmarks
Savoir exploiter les outils de restitution de données

Profil :
Votre profil
De bac +3 à bac +5
Formation universitaire, école d’ingénieur
Compétences techniques dans les outils Big Data (R, Cloudera, Hortonworks, Hive, Ambari, Hue, Superset, Nifi, Oozie…) et Décisionnel (Qlickview, Informatica BODS, BO, Cognos, SAS, Talend…)
Expérience dans le monde bancaire et assurance
il y a 8 mois
- Continuer pour postuler
Signaler cette offre d'emploi",14/02/2019,Big_data,Nantes,14/10/2019,vjk=190d3af80a665909,vide,cdi
