Titre,Nom_Entreprise,Adresse,Salaire,Descriptif_du_poste,Date_de_publication,métier_sc,loc_sc,Date_sc,Identifiant,Experiences,contrat
Ingénieur Big Data H/F (Nantes),Keyrus,Nantes (44),vide,"Nantes (44)
CDI
Keyrus Nantes recherche un Ingénieur Big Data (H/F).

Qui sommes-nous ?
Une success story dans la Data et le Digital !
Notre mission ? Des projets à forte valeur ajoutée pour accroître la performance et la compétitivité des entreprises, faciliter et accélérer leur transformation.
Notre expertise depuis plus de 20 ans ? Le conseil et l'intégration de solutions innovantes autour de trois domaines :
Data Intelligence : Business Intelligence et Big Data & Analytics ;
Digital Experience : Conseil, Stratégie & Performance Digitales ;
Conseil en Management & Transformation : Pilotage de la Performance & Accompagnement des Projets.
Nous sommes plus de 3200 talents sur 18 pays et 4 continents. Notre ADN ? Innover et entreprendre.
Vous êtes ambitieux et souhaitez intégrer un groupe agile et international où vos qualités professionnelles et personnelles seront reconnues et cultivées ?
Pour cela,
Nous vous proposons de nous rejoindre et d’intégrer notre agence Nantaise !
Nos maitres mots sont AGILITE, EXPERTISE, DIVERSITE.

Vos missions ?
Votre mission, si vous l’acceptez, sera de rejoindre nos clients Grands Comptes dans les secteurs d’activités Banque, Assurance, Industrie, Services & Retail.
Votre rôle consistera à :
Analyser les besoins clients et la compréhension des attentes métier du projet ;
Concevoir et réaliser les solutions Big Data : collecte, transformation, analyse et visualisation de données ;
Développer la plateforme Big Data ;
Valider les architectures Hadoop et plateformes associées;
Effectuer les revues de code et valider les bonnes normes de développement.
Nos activités dans la Région Nord-Ouest connaissent une forte croissance !
Rejoindre Keyrus vous permettra de profiter d’opportunités :
En intervenant selon différents modes de prestations (Assistance Technique, Centre de Services, dans différents secteurs d’activités, etc.) au sein d’équipe pluridisciplinaire ayant une forte expérience sur des sujets Big Data ;
En évoluant en fonction de vos centres d’intérêt et de potentiel comme par exemple la possibilité de contribuer activement à porter notre offre Big Data en Région.
Votre goût du challenge et votre capacité à être force de propositions vous permettront de progresser rapidement chez KEYRUS.

Votre profil ?
Cloudera, Machine Learning et Spark n’ont pas de secret pour vous ?
Vous êtes fan de Python et Scala et avez utilisé(e) les bases NoSQL ?
Vous avez une expérience significative dans la conception et le développement des environnements Big Data ?
Vous êtes Ingénieur(e) Big Data et avez la volonté de découvrir des environnements clients innovants au sein d’équipes jeunes et dynamiques ?
Vous souhaitez progresser vers de l’expertise, de la maîtrise d’ouvrage ou de la gestion de projet ?
Keyrus a des projets pour vous ! Alors, n’hésitez plus et postulez !

Pourquoi nous rejoindre ?
Pour intégrer une communauté d’experts curieux et passionnés et évoluer dans un environnement multiculturel, formateur et favorisant la mobilité internationale.
Parce que vous êtes #DataGeek, #DigitalAddict, #InnovationLover
Vous serez tout au long de votre parcours, encouragé(e) et accompagné(e) dans un processus de certification technologique et méthodologique, et aux outils de BI.
#KeyrusRocks #YouRock
Keyrus est une entreprise où il fait bon vivre et travailler !
Découvrez nos animations pour nos collaborateurs sur notre album Facebook et sur Youtube.
Nous découvrir en vidéo, en 3 mots via ce lien.
Des questions - Une Adresse ?
jobs@keyrus.com
Où sommes-nous ?
Euptouyou, immeuble Asturia Bâtiment C, 4 rue Edith Piaf 44 800 Saint-Herblain
il y a 9 mois
- Continuer pour postuler
Signaler cette offre d'emploi",14/01/2019,Big_data,Nantes,14/10/2019,vjk=49fe213597a65671,vide,cdi
Consultant BI/BIG DATA - H/F,Micropole,Nantes (44),vide,"Nantes (44)
CDI
Vous nous connaissez ? Alors super, vous êtes chanceux ou bien renseignés ! Pour les autres, pas de panique, nous allons nous présenter : Micropole est un groupe international spécialisé en conseil et technologies innovantes.
Acteurs incontournables du pilotage de la performance, les collaborateurs Micropole Grand-Ouest participent activement à la croissance et au rayonnement de l’agence. Au quotidien, ces spécialistes de la performance, de la BI, du contrôle de gestion et de l’élaboration budgétaire accompagnent des clients de tous secteurs d’activité dans la définition, le suivi des indicateurs et le pilotage de leurs activités stratégiques & opérationnelles.


Aujourd’hui, Stéphanie, Manager BI Enterprise et Smart BI, est à la recherche de nouveaux talents pour rejoindre sa brillante équipe ! A ce titre, nous recrutons des Consultants BI/BIG DATA à Nantes.


Vos missions :
Au sein d'une équipe de consultants dynamiques ayant à cœur de vous intégrer et de vous accompagner, vous aurez l'opportunité d'intervenir sur des projets décisionnels innovants, riches et variés :
Vous vous positionnerez dès la phase d’avant-vente (préparation des supports, réalisation de la maquette de démonstration, qualification technique des cahiers des charges, préconisation de l’architecture décisionnelle, estimation des charges, soutenance des propositions).
Vous participerez activement aux phases d’étude et réalisation (étude technique, spécifications fonctionnelles, conception, réalisation, tests, formation, maintenance).
Vous accompagnerez la maîtrise d’ouvrage dans la validation de livrables, l’assistance à la recette et la conduite du changement sur le projet.
Vous développerez des relations avec les différents acteurs du partenaire, animerez les réunions et communiquerez autour du projet car nous vous faisons confiance !

Votre profil :
Vous mangez, buvez, dormez et rêvez data
Vous êtes de formation supérieure en informatique Bac +3/5. Vous justifiez d’une expérience significative sur des missions de conception et de réalisation de projets décisionnels et/ou Big Data / Smart Data.
Familier des technologies innovantes, alors : Hadoop, Spark, Splunk, Tableau Software, Talend, Informatica, MS BI, Qlikview, Datastage, Microstrategy, Jedox, SAP BO, … seront vos terrains de jeux favoris !
Vous êtes autonome, impliqué et avez le goût du challenge

En intégrant l’Agence Grand-Ouest vous rejoignez une équipe humaine et dynamique dans laquelle votre savoir-être et votre bonne humeur fera la différence pour inventer le futur de nos clients.
Ne cherchez plus et rejoignez-nous !
Qui ne rêve pas d’être épanoui et heureux au travail ? Si c’est votre souhait, ça tombe bien :depuis 2015, Le Groupe Micropole est labellisé Happy Trainees et Happy at Work for Starters.
En 2018, le Groupe est une nouvelle fois propulsé dans le top 10 des entreprises françaises où il fait bon démarrer sa carrière !
Avec cela vous êtes forcément conquis pour venir travailler avec nous !

Pour vivre de nouvelles et belles aventures, merci d’envoyer votre CV à : recrutement.ouest@micropole.com
#LI-CFL
il y a 8 mois
- Continuer pour postuler
Signaler cette offre d'emploi",14/02/2019,Big_data,Nantes,14/10/2019,vjk=30ffb2f3a45c3cbb,vide,cdi
consultant informatique BIG DATA - Nantes - F/H,TECH VALLEY,Nantes (44),vide,"Nantes (44)
TECH VALLEY est une société de Consulting en Systèmes d’Informations, et d’Expertise en ingénierie informatique, constituée d’une équipe de consultants, d’ingénieurs, et d’experts.
Nous mettons en avant une vision fédératrice de la qualité des SI : robustesse, efficacité, dimensionnement, sécurité, performance, évolutivité, conformité, optimisation.
Nous intervenons au national dans l’accompagnement des Grands Comptes et des ETI secteurs industrie, médical, telecom, finance, énergie, sur la transition de l’industrialisation des systèmes d’informations, principalement sur les architectures fonctionnelles, les process de développement et intégration, la Qualité et sécurité des systèmes d’informations, la fiabilité et les performances, ainsi que sur les architectures techniques et opérationnelles, les process de production et changement.
Le siège de la société se situe à Perpignan Tecnosud, nos agences couvrent nos interventions à Toulouse, Bordeaux, Nantes, Lille, Paris, Lyon, Montpellier, Aix, Sophia Antipolis.

Intitulé du poste : Consultant BIG DATA

Site : Nantes

Postes ouverts au recrutement :
. Consultants BIG DATA

Vos compétences :
. Technologies parmi : Hadoop, Hortonworks, Cloudera, CouchBase (NoSQL), ElasticSearch, Spark, Kibana, ELK Stack, Hive, Sqoop
. Bases de données NOSQL parmi MongoDB, Teradata, CouchBase, CouchBase, Cassandra, Dataguard, Neo4J

Votre expérience, votre sens du service, votre goût du travail en équipe et vos qualités relationnelles font partie de vos atouts, rejoignez la team TECH VALLEY !

TECH VALLEY - Consultants en Systèmes et Technologies de l’Information - France
carriere-info - il y a 8 mois
- Continuer pour postuler
Signaler cette offre d'emploi",14/02/2019,Big_data,Nantes,14/10/2019,vjk=3ed957a633d3b0bb,vide,vide
Ingénieur(e) Big Data (F/H),alteca,Nantes (44),vide,"Nantes (44)
CDI
Localisation : Nantes
Métier : Data
Contrat : CDI
Poste & Missions :
< Développez votre carrière >
Vous aspirez à vous épanouir dans un environnement stimulant et convivial ? Vous êtes passionné(e) par les domaines de l'Informatique et du Digital ? Vous avez envie d'évoluer et de progresser dans des contextes applicatifs et d'infrastructures dynamique à fortes ampleur.
Rejoignez une entreprise où la vision à long terme, l'ambition et les valeurs humaines seront les connecteurs de votre projet professionnel !
En effet, dans la continuité de son développement, le groupe Alteca recherche un(e) Ingénieur(e) Big Data (F/H).

< Découvrez votre challenge >
En tant qu'Ingénieur(e) Big Data, vous serez intégré(e) au Pôle Data de l'agence de Nantes, récemment créé. Au sein de ce pôle, nous avons la volonté de constituer des équipes bénéficiant d'une triple compétence (technique, décisionnelle et métier) afin de prendre en charge les problématiques de gestion de données (structurées ou non-structurées).
Votre challenge:
: analyse des besoins utilisateurs, étude de faisabilité, définition de la conception technique
[20 %] Conception et gestion de l'architecture : définition de l'architecture, prototypage et expérimentation technique.
[20 %] Analyse des données : mise en place des flux de données, collecte et stockage
[40 %] Valorisation des données : exploitation et distribution des données en assurant la montée en charge et les performances, test, intégration et mise en production des différents développements, restitutions.
[10 %] Support technique : suivi de production, maintenance et veille technologique.
Profil recherché :
< Démontrez vos talents >
Votre profil : diplômé(e) d'un Bac+3 à Bac+5 en informatique (Ingénieur ou Universitaire), Vous souhaitez vous investir et développer votre expertise technique dans le traitement des données : Cassandra, Talend, Hive, Hadoop, Pig, Spark, MongoBD, Actuate BIRT...
Vous justifiez idéalement d'une première expérience significative dans la gestion et l'exploitation de données. Vous maîtrisez les bases de données, le langage SQL et la programmation JAVA dans un environnement technique type GIT, Eclipse, Maven, Jenkins, Artefactory... Vous êtes familier avec les systèmes d'exploitation windows et linux. Vous êtes à l'aise dans des organisations fonctionnant en mode projet.
Votre personnalité : esprit d'équipe, autodidacte, autonome, force de proposition, curiosité, rigueur.

< Développez votre curiosité >
Alteca est une entreprise française de services numériques de plus de 700 collaborateurs, dotée d'une forte implantation nationale à travers 8 agences.

Acteur de référence auprès de ses partenaires grand comptes dans les secteurs de la grande distribution, la banque, l'assurance, mais aussi les organismes publics et l'industrie, Alteca propose une grande diversité de métiers et de carrières dans le domaine du Numérique.

Rejoindre l'aventure Alteca, c'est intégrer une entreprise jeune et dynamique, en pleine croissance et découvrir :
Des valeurs qui nous tiennent à cœur : travail en équipe, entraide, professionnalisme et bonne humeur,
Un environnement évolutif et dynamique,
Des formations ""sur mesure"" avec la possibilité de passer des certifications,
La possibilité de développer votre carrière vers de l'expertise ou de la gestion de projet,
Une atmosphère familiale,
Des espaces collaboratifs (communautés fun ou d'expertise, sportives ou gastronomique, espaces d'échanges et de formation dédiées, documentation, wiki, ...) pour capitaliser vos savoirs/savoir-faire et savoir-être.
il y a 9 mois
- Continuer pour postuler
Signaler cette offre d'emploi",14/01/2019,Big_data,Nantes,14/10/2019,vjk=2aa34a67f34bac27,vide,cdi
Architecte Big Data,Siderlog,Nantes (44),vide,"Nantes (44)
Nantes | Niort

Du plaisir à faire son travail, dans un environnement stimulant où l’on apprécie la qualité de la relation humaine.
Voilà le ressenti exprimé par les femmes et les hommes de Siderlog.

Vos missions
Etre responsable de la définition, de la conception et de la construction de plate-formes ainsi que des solutions Big Data
Assurer des missions d’expertise sur les architectures clients.
Etre force de conseil dans les solutions proposées aux clients.
Etre en capacité d’amener une expertise pragmatique sur les bases de données SQL et NoSql.
Qualifier les cas d’usages.
Mettre en œuvre les benchmarks.
Piloter la performance au sein de nos projets.

Votre profil
Bac +4 / +5.
Expérience de 10 ans minimum.
Passionné(e) par les projets Big Data et tout particulièrement au rôle d’architecte.
Maîtrise des technologies SQL et NoSql.
Connaissance d’une ou plusieurs distributions Hadoop.
La connaissance d’outils de business intelligence (ETL, outils de reporting et outils d’exploration de données) serait un plus.

Lieux
Nantes
Niort
il y a 10 mois
- Continuer pour postuler
Signaler cette offre d'emploi",14/12/2018,Big_data,Nantes,14/10/2019,vjk=8e659afcc813a527,vide,vide
Développeur Big Data (H/F),ASI,Nantes (44),vide,"Nantes (44)
CDI
Vous aurez pour missions de :
Utiliser l’écosystème distribué Hadoop
Développer une chaîne de traitement de l’information de bout en bout
Participer aux spécifications techniques
Qui êtes-vous ?
Titulaire d’un Bac+4/5 (Ecole d’Ingénieur ou Universitaire), vous disposez d’une expérience acquise sur des projets mettant en oeuvre les technologies du Big Data :
Langage de développement : Scala, Java
Big Data : Pig, Hive, Spark, Kafka
Distribution Hadoop : Cloudera et/ou Horton Works
Passionné(e) par votre métier, vous avez envie de travailler sur des projets innovants à forte valeur ajoutée ? Rejoignez-nous !
il y a 10 mois
- Continuer pour postuler
Signaler cette offre d'emploi",14/12/2018,Big_data,Nantes,14/10/2019,vjk=af1048d010488568,vide,cdi
